"0","1467810369","Mon Apr 06 22:19:45 PDT 2009","NO_QUERY","_TheSpecialOne_","@switchfoot http://twitpic.com/2y1zl - Awww, that's a bummer.  You shoulda got David Carr of Third Day to do it. ;D"
"0","1467813985","Mon Apr 06 22:20:37 PDT 2009","NO_QUERY","quanvu","@alydesigns i was out most of the day so didn't get much done "
"0","1467818020","Mon Apr 06 22:21:39 PDT 2009","NO_QUERY","itsanimesh","really don't feel like getting up today... but got to study to for tomorrows practical exam... "
"0","1467822687","Mon Apr 06 22:22:52 PDT 2009","NO_QUERY","xVivaLaJuicyx","@BatManYNG I miss my ps3, it's out of commission  Wutcha playing? Have you copped 'Blood On The Sand'?"
"0","1467834053","Mon Apr 06 22:25:52 PDT 2009","NO_QUERY","thelazyboy","sleep soon... i just hate saying bye and see you tomorrow for the night. "
"0","1467836873","Mon Apr 06 22:26:33 PDT 2009","NO_QUERY","LeakySpoon"," Body Of Missing Northern Calif. Girl Found: Police have found the remains of a missing Northern California girl .. http://tr.im/imji"
"0","1467839737","Mon Apr 06 22:27:21 PDT 2009","NO_QUERY","JenBah","Is pissed off that there's no ASBA's for a radio station. "
"0","1467843075","Mon Apr 06 22:28:15 PDT 2009","NO_QUERY","darkninja757","sadly is going to bed. "
"0","1467853356","Mon Apr 06 22:30:54 PDT 2009","NO_QUERY","dbmendel","Picked Mich St to win it all from the get go.  Was feeling pretty good about that pick all the way up until......tonight.  A's lost too "
"0","1467857511","Mon Apr 06 22:31:59 PDT 2009","NO_QUERY","fatkat309","@dannyvegasbaby danny im upset that i wasnt here to watch the live chat  i was in a car. for 3 hours on a trip im soooo upset!!"
"1","2193529732","Tue Jun 16 08:34:56 PDT 2009","NO_QUERY","idrake76","@cherub_rock123 ehh....it's a day. "
"1","2193551278","Tue Jun 16 08:36:41 PDT 2009","NO_QUERY","white_thief","Back on the job with some coffee thanks to @chimolschimols "
"1","2193552024","Tue Jun 16 08:36:44 PDT 2009","NO_QUERY","bdottie","What a pretty day  &quot;Just smile&quot;"
"1","2193552958","Tue Jun 16 08:36:49 PDT 2009","NO_QUERY","angelxwarrior","@kazzc22 no probs kazz hun,i think theres a new one going on now celebrity twitterer or summat? lol dunno?i just voted misha anyways "
"1","2193553734","Tue Jun 16 08:36:53 PDT 2009","NO_QUERY","shellyboo27","No more drives. =D license in a moth "
"1","2193574897","Tue Jun 16 08:38:37 PDT 2009","NO_QUERY","johnwelshphd","@cris1015 My goal on stocks like $MTXX is to help, if just one person avoided this stock on my post, would make the keystrokes worth it.  "
"1","2193575839","Tue Jun 16 08:38:42 PDT 2009","NO_QUERY","bendotorg","Largest/fastest hotspot in U.S.A. is located in Atlanta. Suck it people outside the ATL  JK...no idea how to use it! http://bit.ly/eDjz7"
"1","2193576797","Tue Jun 16 08:38:47 PDT 2009","NO_QUERY","jaycemiguel","@MsKCJones Yeah it's very irritating, right? But with God on your side, you cant fail. "
"1","2193577726","Tue Jun 16 08:38:52 PDT 2009","NO_QUERY","FrayBaby","@pokapolas love the donut and the toadstool.  "
"1","2193578679","Tue Jun 16 08:38:56 PDT 2009","NO_QUERY","puchal_ek","@myheartandmind jo jen by nemuselo zrovna té holce ael co nic "